dat_ref,fonte,titulo,link
2025-07-13,Seu Dinheiro,"É improvável que tarifa de 50% dos EUA às importações brasileiras se torne permanente, diz UBS WM",https://www.seudinheiro.com/2025/economia/e-improvavel-que-tarifa-de-50-dos-eua-as-importacoes-brasileiras-se-torne-permanente-julw/
2025-07-13,Seu Dinheiro,"Gestores de fundos imobiliários passam a ficar otimistas, após sentimento negativo do 1º semestre; saiba os motivos",https://www.seudinheiro.com/2025/bolsa-dolar/gestores-de-fundos-imobiliarios-passam-a-ficar-otimistas-apos-sentimento-negativo-do-1o-semestre-julw/
2025-07-13,Seu Dinheiro,"‘IA dos investimentos’ chama atenção após usar fórmula de matemático do MIT — ganhos diários podem chegar até R$ 1 mil, em média",https://www.seudinheiro.com/2025/patrocinado/optme/ia-dos-investimentos-chama-atencao-apos-usar-formula-de-matematico-do-mit-ganhos-diarios-podem-chegar-ate-r-1-mil-em-media-lbrd7ml035/
2025-07-13,Seu Dinheiro,"Bolsonaro é a razão da tarifa mais alta para o Brasil, admite membro do governo dos EUA — mas ele foge da pergunta sobre déficit comercial",https://www.seudinheiro.com/2025/economia/bolsonaro-e-a-razao-da-tarifa-mais-alta-para-o-brasil-admite-membro-do-governo-dos-eua-julw/
2025-07-13,Seu Dinheiro,Alta do Ibovespa e ‘volta’ do Fundo Verde à bolsa reforçam otimismo com ações brasileiras; conheça os papéis mais promissores para julho,https://www.seudinheiro.com/2025/patrocinado/empiricus/alta-do-ibovespa-e-volta-do-fundo-verde-a-bolsa-reforcam-otimismo-com-acoes-brasileiras-lbrdaz133/
2025-07-13,Seu Dinheiro,SpaceX vai investir US$ 2 bilhões na empresa de Inteligência Artificial de Elon Musk,https://www.seudinheiro.com/2025/empresas/spacex-vai-investir-us-2-bilhoes-na-empresa-de-inteligencia-artificial-de-elon-musk-julw/
2025-07-13,Seu Dinheiro,Taurus (TASA4) é multada em R$ 25 milhões e fica suspensa de contratar com a administração do estado de São Paulo por dois anos,https://www.seudinheiro.com/2025/empresas/taurus-tasa4-e-multada-em-r-25-milhoes-e-fica-suspensa-de-contratar-com-a-administracao-do-estado-de-sao-paulo-por-dois-anos-julw/
2025-07-13,Seu Dinheiro,"Visto americano vai ficar mais caro em quase R$ 1,4 mil após Big Beautiful Bill de Trump; entenda",https://www.seudinheiro.com/2025/lifestyle/visto-americano-vai-ficar-mais-caro-em-quase-r-14-mil-julw
2025-07-13,Seu Dinheiro,Petrobras (PETR4) ainda pode pagar dividendos extraordinários? Este analista deu o veredito do que fazer com a ação,https://www.seudinheiro.com/2025/select/petrobras-petr4-ainda-pode-pagar-dividendos-extraordinarios-este-analista-deu-o-veredito-do-que-fazer-com-a-acao-lbrdgm004/
2025-07-13,Seu Dinheiro,"Sem milionários, só Lotofácil fez ganhadores neste sábado (12); Mega-Sena acumula em R$ 46 milhões. Veja resultados das loterias",https://www.seudinheiro.com/2025/economia/resultados-loterias-12-07-2025-julw/
2025-07-13,Seu Dinheiro,"Este fundo imobiliário vai pagar os maiores dividendos da história, mas ficou de fora da lista de FIIs favoritos deste analista; entenda",https://www.seudinheiro.com/2025/patrocinado/empiricus/este-fundo-imobiliario-vai-pagar-os-maiores-dividendos-da-historia-mas-ficou-de-fora-da-lista-de-fiis-favoritos-deste-analista-entenda-lbrd11mp042/
2025-07-13,Seu Dinheiro,A corrida da IA levará à compra (ou quebra) de jornais e editoras?,https://www.seudinheiro.com/2025/colunistas/a-corrida-da-ia-levara-a-compra-ou-quebra-de-jornais-e-editoras/
2025-07-12,Seu Dinheiro,"Banco do Brasil (BBAS3), ataque hacker, FII do mês e tarifas de 50% de Trump: confira as notícias mais lidas da semana",https://www.seudinheiro.com/2025/economia/banco-do-brasil-ataque-hacker-fii-do-mes-e-tarifas-de-50-de-trump-confira-as-noticias-mais-lidas-da-semana-julw/
2025-07-12,Seu Dinheiro,Preço do aluguel em São Paulo finalmente estaciona e não sobe pela primeira vez em 4 anos; veja os bairros mais valorizados,https://www.seudinheiro.com/2025/financas-pessoais/preco-do-aluguel-em-sao-paulo-finalmente-estaciona-e-nao-sobe-pela-primeira-vez-em-4-anos-julw/
2025-07-12,Seu Dinheiro,"Bitcoin (BTC) acelera sem olhar para o retrovisor, ultrapassando os US$ 118 mil; mercado já fala em criptomoeda nos US$ 145 mil",https://www.seudinheiro.com/2025/select/bitcoin-btc-acelera-sem-olhar-retrovisor-us-118-mil-mercado-fala-criptomoeda-us-145-mil-lbrdlc641/
2025-07-12,Seu Dinheiro,"Petrobras (PETR4) e Vale (VALE3) se salvaram, mas não a Embraer (EMBR3); veja as maiores altas e quedas do Ibovespa na última semana",https://www.seudinheiro.com/2025/bolsa-dolar/petrobras-vale-embraer-brf-maiores-altas-e-quedas-do-ibovespa-na-ultima-semana-julw/
2025-07-12,Seu Dinheiro,"Tarifas de Trump podem afastar investimentos estrangeiros em países emergentes, como o Brasil",https://www.seudinheiro.com/2025/economia/tarifas-de-trump-podem-afastar-investimentos-estrangeiros-em-paises-emergentes-como-o-brasil-julw/
2025-07-12,Seu Dinheiro,Fleury (FLRY3) entra em carteira recomendada de dividendos da Empiricus Research — será que vale a pena investir na antiga ‘queridinha da Bolsa’?,https://www.seudinheiro.com/2025/patrocinado/empiricus/fleury-flry3-entra-em-carteira-recomendada-de-dividendos-da-empiricus-research-sera-que-vale-a-pena-investir-na-antiga-queridinha-da-bolsa-lbrdlh191/
2025-07-12,Seu Dinheiro,Congresso pede que STF valide decreto legislativo que derrubou aumento do IOF do governo Lula,https://www.seudinheiro.com/2025/politica/congresso-pede-que-stf-valide-decreto-legislativo-que-derrubou-aumento-do-iof-do-governo-lula-julw/
2025-07-12,Seu Dinheiro,Trump anuncia tarifas de 30% sobre importações da União Europeia e do México a partir de agosto; veja os motivos,https://www.seudinheiro.com/2025/internacional/trump-anuncia-tarifas-de-30-sobre-importacoes-da-uniao-europeia-e-do-mexico-a-partir-de-agosto-julw/
